{
  "contracts": [
    {
      "authoring_id": "examples.memory_customers:RawCustomer",
      "fields": [
        {
          "name": "customer_id",
          "nullable": false,
          "required": true,
          "type": "integer"
        },
        {
          "name": "first_name",
          "nullable": false,
          "required": true,
          "type": "string"
        },
        {
          "name": "last_name",
          "nullable": false,
          "required": true,
          "type": "string"
        }
      ],
      "identity": "rawcustomer",
      "metadata": {},
      "name": "RawCustomer",
      "version": "1.0.0"
    },
    {
      "authoring_id": "examples.memory_customers:Customer",
      "fields": [
        {
          "name": "customer_id",
          "nullable": false,
          "required": true,
          "type": "integer"
        },
        {
          "name": "full_name",
          "nullable": false,
          "required": true,
          "type": "string"
        }
      ],
      "identity": "customer",
      "metadata": {},
      "name": "Customer",
      "version": "1.0.0"
    }
  ],
  "edges": [
    {
      "consumer_contract_id": "examples.memory_customers:RawCustomer",
      "consumer_node": "normalized",
      "consumer_port": "customers",
      "producer_contract_id": "examples.memory_customers:RawCustomer",
      "producer_node": "raw",
      "producer_port": "result"
    },
    {
      "consumer_contract_id": "examples.memory_customers:Customer",
      "consumer_node": "curated",
      "consumer_port": "input",
      "producer_contract_id": "examples.memory_customers:Customer",
      "producer_node": "normalized",
      "producer_port": "result"
    }
  ],
  "extensions": {},
  "fingerprint": "660b905db2411f7b6f5439c509188c93213d708f654b969eb761307b8f5a7af2",
  "metadata": {},
  "nodes": [
    {
      "asset": "customer_source",
      "bindings": {},
      "contract_id": "examples.memory_customers:RawCustomer",
      "identity": "examples.memory_customers:CustomerPipeline/raw",
      "inputs": [],
      "kind": "source",
      "metadata": {},
      "name": "raw",
      "nested": null,
      "nested_pipeline_id": null,
      "outputs": [
        {
          "contract_id": "examples.memory_customers:RawCustomer",
          "direction": "output",
          "has_default": false,
          "has_value": false,
          "name": "result",
          "required": true,
          "role": "valid",
          "value_type": null
        }
      ],
      "parameters": [],
      "transformation_id": null,
      "transformation_name": null
    },
    {
      "asset": null,
      "bindings": {},
      "contract_id": null,
      "identity": "examples.memory_customers:CustomerPipeline/normalized",
      "inputs": [
        {
          "contract_id": "examples.memory_customers:RawCustomer",
          "direction": "input",
          "has_default": false,
          "has_value": false,
          "name": "customers",
          "required": true,
          "role": "valid",
          "value_type": null
        }
      ],
      "kind": "step",
      "metadata": {},
      "name": "normalized",
      "nested": null,
      "nested_pipeline_id": null,
      "outputs": [
        {
          "contract_id": "examples.memory_customers:Customer",
          "direction": "output",
          "has_default": false,
          "has_value": false,
          "name": "result",
          "required": true,
          "role": "valid",
          "value_type": null
        }
      ],
      "parameters": [],
      "transformation_id": "examples.memory_customers:NormalizeCustomers",
      "transformation_name": "NormalizeCustomers"
    },
    {
      "asset": "customer_sink",
      "bindings": {},
      "contract_id": "examples.memory_customers:Customer",
      "identity": "examples.memory_customers:CustomerPipeline/curated",
      "inputs": [
        {
          "contract_id": "examples.memory_customers:Customer",
          "direction": "input",
          "has_default": false,
          "has_value": false,
          "name": "input",
          "required": true,
          "role": "valid",
          "value_type": null
        }
      ],
      "kind": "sink",
      "metadata": {},
      "name": "curated",
      "nested": null,
      "nested_pipeline_id": null,
      "outputs": [],
      "parameters": [],
      "transformation_id": null,
      "transformation_name": null
    }
  ],
  "pipeline_id": "examples.memory_customers:CustomerPipeline",
  "pipeline_name": "CustomerPipeline",
  "policy_refs": {},
  "profile_ref": null,
  "provenance": {
    "kind": "python",
    "source_identity": "examples.memory_customers:CustomerPipeline"
  },
  "reliability": {},
  "schema": "etlantic.pipeline/1",
  "transformations": [
    {
      "identity": "examples.memory_customers:NormalizeCustomers",
      "implementation_refs": [
        {
          "engine": "local",
          "identity": "examples.memory_customers:NormalizeCustomers/local",
          "is_async": false,
          "kind": "native"
        }
      ],
      "metadata": {},
      "name": "NormalizeCustomers",
      "portable_plan": null,
      "ports": [
        {
          "contract_id": "examples.memory_customers:RawCustomer",
          "direction": "input",
          "has_default": false,
          "has_value": false,
          "name": "customers",
          "required": true,
          "role": "valid",
          "value_type": null
        },
        {
          "contract_id": "examples.memory_customers:Customer",
          "direction": "output",
          "has_default": false,
          "has_value": false,
          "name": "result",
          "required": true,
          "role": "valid",
          "value_type": null
        }
      ],
      "version": null
    }
  ],
  "version": null
}
